nct_id,dropout_percentage_all,Clinical Title,Overall Status,Trial Phase,Allocation,Start Date,Completion Date,Primary Purpose,City,State,Zipcode,Gender,Minimum Age,New Completion Date,New Start Date,length_of_trial,RUCA2.0,Cleaned_Zipcodes
NCT01443078,4.761904762,"Neoadjuvant Platinum-based Chemotherapy for Patients With Resectable , Non-small Cell Lung Cancer With Switch to Chemotherapy Alternative in Nonresponders (NEOSCAN)",Completed,Phase 2,,October 2011,April 2015,Treatment,Basking Ridge,New Jersey,11725,All,18.0,2015-04-01,2011-10-01,1278.0,1.0,11725
NCT01443845,20.74199622,Roflumilast in Chronic Obstructive Pulmonary Disease (COPD) Patients Treated With Fixed Dose Combinations of Long-acting β2-agonist (LABA) and Inhaled Corticosteroid (ICS),Completed,Phase 4,Randomized,"September 30, 2011","January 31, 2016",Treatment,Anniston,Alabama,36207,All,40.0,2016-01-01,2011-09-01,1583.0,1.0,36207
NCT01444430,1.094658869,A 6 Month Safety Study Comparing Symbicort With Inhaled Corticosteroid Only in Asthmatic Adults and Adolescents,Completed,Phase 3,Randomized,December 2011,October 2015,Treatment,Birmingham,Alabama,,All,12.0,2015-10-01,2011-12-01,1400.0,1.0,35203
NCT01448850,20.07621951,A Study to Evaluate the Efficacy of MEDI8968 in Chronic Obstructive Pulmonary Disease,Completed,Phase 2,Randomized,November 2011,February 2014,Treatment,Peoria,Arizona,,All,45.0,2014-02-01,2011-11-01,823.0,1.0,61602
NCT01450761,30.47976513,Trial in Extensive-Disease Small Cell Lung Cancer (ED-SCLC) Subjects Comparing Ipilimumab Plus Etoposide and Platinum Therapy to Etoposide and Platinum Therapy Alone,Completed,Phase 3,Randomized,"December 13, 2011","May 17, 2017",Treatment,Hot Springs,Arkansas,71913,All,18.0,2017-05-01,2011-12-01,1978.0,1.0,71913
NCT01451541,10.16264114,A Safety and Efficacy Study of Ciclesonide Nasal Aerosol in Subjects 6-11 Years With Perennial Allergic Rhinitis (PAR).,Completed,Phase 3,Randomized,October 2011,December 2012,Treatment,Hot Springs,Arkansas,71913,All,6.0,2012-12-01,2011-10-01,427.0,1.0,71913
NCT01453023,3.846153846,"Inhaled Fluticasone Furoate/Vilanterol Safety and Tolerability, PK and PD Study",Completed,Phase 2,Randomized,October 2011,June 2012,Treatment,Huntington Beach,California,92647,All,5.0,2012-06-01,2011-10-01,244.0,1.0,92647
NCT01453296,5.357142857,Pharmacokinetics and Pharacodynamics of GW642444 in Paedetric Subjects,Completed,Phase 2,Randomized,August 2010,April 2011,Treatment,Cypress,California,90630,All,5.0,2011-04-01,2010-08-01,243.0,1.0,90630
NCT01454934,20.37037037,"A Randomized, Open-label, Multicenter, Phase 3 Study to Compare the Efficacy and Safety of Eribulin With Treatment of Physician's Choice in Subjects With Advanced Non-Small Cell Lung Cancer",Completed,Phase 3,Randomized,"December 9, 2011","May 2, 2016",Treatment,Los Angeles,California,,All,18.0,2016-05-01,2011-12-01,1613.0,1.0,90001
NCT01458275,4.249471635,A Safety and Efficacy Study of Ciclesonide Nasal Aerosol in Subjects 6-11 Years With Seasonal Allergic Rhinitis (SAR),Completed,Phase 3,Randomized,November 2011,March 2013,Treatment,Little Rock,Arkansas,72205,All,6.0,2013-03-01,2011-11-01,486.0,1.0,72205
NCT01462344,10.51815049,6-month Safety and Benefit Study of ADVAIR in Children 4-11 Years Old,Completed,Phase 4,Randomized,"November 17, 2011","November 3, 2015",Treatment,Birmingham,Alabama,35209,All,4.0,2015-11-01,2011-11-01,1461.0,1.0,35209
NCT01465802,20.7012664,Study Of Dacomitinib (PF-00299804) In Advanced NSCLC Patients (Post Chemo Or Select First Line) To Evaluate Prophylactic Intervention On Derm And GI AEs And PRO,Completed,Phase 2,Non-Randomized,"December 26, 2011","May 18, 2015",Treatment,Duarte,California,91010,All,18.0,2015-05-01,2011-12-01,1247.0,1.0,91010
NCT01475721,0.1369981522,SAS115359: A 6-month Study to Assess the Safety and Benefit of Inhaled Fluticasone Propionate/Salmeterol Combination Compared With Inhaled Fluticasone Propionate in the Treatment of Adolescents and Adults (12 Years of Age and Older) With Asthma.,Completed,Phase 4,Randomized,"November 18, 2011","June 23, 2015",Treatment,Athens,Alabama,35611,All,12.0,2015-06-01,2011-11-01,1308.0,4.2,35611
NCT01479595,4.653679654,A Study to Establish the Efficacy of QBX258 in Patients With Moderate to Severe Asthma,Completed,Phase 2,Randomized,February 2012,February 2015,Treatment,Anaheim,California,92801,All,18.0,2015-02-01,2012-02-01,1096.0,1.0,92801
NCT01479621,11.57580284,A Study of the Effectiveness and Safety of Different Doses of Fluticasone Propionate Taken From a Dry Powder Inhaler in Adolescents and Adults Who Have Asthma That is Not Controlled by Asthma Medications Not Containing Steroids,Completed,Phase 2,Randomized,January 2012,July 2013,Treatment,Homewood,Alabama,,All,12.0,2013-07-01,2012-01-01,547.0,1.0,60430
NCT01483625,5.555555556,Tiotropium (18mcg) in Chronic Obstructive Pulmonary Disease (COPD) Patients With a Respiratory Infection,Completed,Phase 4,Randomized,November 2011,December 2012,Treatment,Tucson,Arizona,,All,40.0,2012-12-01,2011-11-01,396.0,1.0,85701
NCT01500720,7.833957553,Cabazitaxel Compared to Topotecan for the Treatment of Small Cell Lung Cancer,Completed,Phase 2,Randomized,March 2012,April 2014,Treatment,Muscle Shoals,Alabama,35661,All,18.0,2014-04-01,2012-03-01,761.0,1.0,35661
NCT01504867,1.538461538,LIPS-A: Lung Injury Prevention Study With Aspirin,Completed,Phase 2,Randomized,January 2012,September 2015,Prevention,Stanford,California,94305,All,18.0,2015-09-01,2012-01-01,1339.0,1.0,94305
NCT01508936,21.53368885,Study to Evaluate the Efficacy and Safety of Reslizumab Treatment in Patients With Moderate to Severe Asthma,Completed,Phase 3,Randomized,February 2012,August 2013,Treatment,Birmingham,Alabama,,All,18.0,2013-08-01,2012-02-01,547.0,1.0,35203
NCT01519661,31.21019108,Long Term Safety of Tobramycin Inhalation Powder in Patients With Cystic Fibrosis,Completed,Phase 4,Non-Randomized,January 2012,January 2014,Treatment,Little Rock,Arkansas,72205,All,6.0,2014-01-01,2012-01-01,731.0,1.0,72205
NCT01523587,21.06890696,LUX-Lung 8: A Phase III Trial of Afatinib (BIBW 2992) Versus Erlotinib for the Treatment of Squamous Cell Lung Cancer After at Least One Prior Platinum Based Chemotherapy,Completed,Phase 3,Randomized,"March 5, 2012","December 27, 2017",Treatment,Chandler,Arizona,85224,All,18.0,2017-12-01,2012-03-01,2101.0,1.0,85224
NCT01525615,6.728588421,A Study to Determine the Effect of Tiotropium + Olodaterol Fixed Dose Combination on Exercise Endurance Time During Constant Work Rate Cycle Ergometry Test in COPD,Completed,Phase 3,Randomized,February 2012,September 2013,Treatment,Torrance,California,,All,40.0,2013-09-01,2012-02-01,578.0,1.0,90501
NCT01529112,8.878847093,"A Study Comparing the Combination of the Best Supportive Care Plus E7080 Versus Best Supportive Care Alone, in Patients With Advanced Lung Cancer or Lung Cancer That Has Spread, Who Have Been Previously Treated, Unsuccessfully, With at Least 2 Different Treatments",Completed,Phase 2,Randomized,November 2011,"June 27, 2015",Treatment,Casa Grande,Arizona,85122,All,18.0,2015-06-01,2011-11-01,1308.0,1.0,85122
NCT01531673,0.0,Study of VX-661 Alone and in Combination With Ivacaftor in Subjects Homozygous or Heterozygous to the F508del-Cystic Fibrosis Transmembrane Conductance Regulator(CFTR) Mutation,Completed,Phase 2,Randomized,February 2012,March 2014,Treatment,Birmingham,Alabama,,All,12.0,2014-03-01,2012-02-01,759.0,1.0,35203
NCT01533181,0.0,Linsitinib or Topotecan Hydrochloride in Treating Patients With Relapsed Small Cell Lung Cancer,Completed,Phase 2,Randomized,February 2012,November 2014,Treatment,Scottsdale,Arizona,85259,All,18.0,2014-11-01,2012-02-01,1004.0,1.0,85259
NCT01533922,2.847457627,Effect on Exercise Endurance and Lung Hyperinflation of Tiotropium + Olodaterol in COPD Patients,Completed,Phase 3,Randomized,March 2012,November 2013,Treatment,Torrance,California,,All,40.0,2013-11-01,2012-03-01,610.0,1.0,90501
NCT01533935,2.886597938,Effect on Exercise Endurance and Lung Hyperinflation of Tiotropium + Olodaterol in COPD Patients.,Completed,Phase 3,Randomized,February 2012,November 2013,Treatment,Phoenix,Arizona,,All,40.0,2013-11-01,2012-02-01,639.0,1.0,13135
NCT01535040,38.46153846,Memantine Hydrochloride in Helping Cancer Survivors Stop Smoking,Completed,Phase 2,Randomized,"August 1, 2012","February 1, 2014",Supportive Care,Winston-Salem,North Carolina,27157,All,18.0,2014-02-01,2012-08-01,549.0,1.0,27157
NCT01537081,2.792632204,Safety and Efficacy of Mucinex and IR Guaifenesin the Treatment of Symptoms of Acute Upper Respiratory Tract Infections,Completed,Phase 2/Phase 3,Randomized,September 2011,July 2012,Treatment,Hoover,Alabama,35216,All,12.0,2012-07-01,2011-09-01,304.0,1.0,35216
NCT01557166,22.27808814,Effect of Liraglutide in Obese Subjects With Moderate or Severe Obstructive Sleep Apnoea: SCALE™ - Sleep Apnoea,Completed,Phase 3,Randomized,"June 7, 2012","June 17, 2013",Treatment,Glendale,California,91206,All,18.0,2013-06-01,2012-06-01,365.0,1.0,91206
NCT01560988,14.51612903,Borage and Echium Seed Oils for Asthma,Completed,Phase 3,Randomized,February 2013,May 2015,Treatment,Boston,Massachusetts,02115,All,18.0,2015-05-01,2013-02-01,819.0,1.0,02115
NCT01563029,5.730142905,A Dose-ranging Study of Fluticasone Furoate (FF),Completed,Phase 2,Randomized,"March 28, 2012","September 24, 2014",Treatment,Little Rock,Arkansas,72205,All,5.0,2014-09-01,2012-03-01,914.0,1.0,72205
NCT01572792,45.19236583,"Efficacy, Safety and Tolerability of Two Fixed Dose Combinations of Aclidinium Bromide/Formoterol Fumarate, Aclidinium Bromide, Formoterol Fumarate and Placebo for 28-Weeks Treatment in Patients With Moderate to Severe, Stable Chronic Obstructive Pulmonary Disease (COPD)",Completed,Phase 3,Randomized,April 2012,June 2013,Treatment,Anniston,Alabama,36207,All,40.0,2013-06-01,2012-04-01,426.0,1.0,36207
NCT01573624,1.153715643,"Evaluate the Safety, Efficacy and Dose Response of GSK573719 in Combination With Fluticasone Furoate in Subjects With Asthma",Completed,Phase 2,Randomized,"April 3, 2012","February 4, 2013",Diagnostic,Saint Louis,Missouri,63141,All,18.0,2013-02-01,2012-04-01,306.0,1.0,63141
NCT01573767,3.068336,Dose-ranging Study of Vilanterol (VI) Inhalation Powder in Children,Completed,Phase 2,Randomized,April 2012,April 2014,Treatment,Birmingham,Alabama,35209,All,5.0,2014-04-01,2012-04-01,730.0,1.0,35209
NCT01576718,9.016046553,A Study of the Effectiveness and Safety of Different Doses of Fluticasone Propionate Taken From a Dry Powder Inhaler (Puffer) in Adolescents and Adults Who Have Asthma That is Not Controlled by High Dose Inhaled Corticosteroid Asthma Medications,Completed,Phase 2,Randomized,April 2012,October 2013,Treatment,Birmingham,Alabama,,All,12.0,2013-10-01,2012-04-01,548.0,1.0,35203
NCT01579916,3.085625254,A Study to Evaluate the Safety of 3 New 6:2 Influenza Virus Reassortants in Adults,Completed,Phase 4,Randomized,May 2012,November 2012,Prevention,Miami,Florida,33143,All,18.0,2012-11-01,2012-05-01,184.0,1.0,33143
NCT01588405,3.03030303,Remodulin® to Oral Treprostinil Transition,Completed,Phase 2,,April 2012,December 2014,Treatment,Phoenix,Arizona,85013,All,15.0,2014-12-01,2012-04-01,974.0,1.0,85013
NCT01597375,4.678848283,Therapeutic Control of Aspirin-Exacerbated Respiratory Disease (Aspirin),Completed,Phase 2,Randomized,"August 31, 2012","December 14, 2016",Supportive Care,Boston,Massachusetts,02115,All,18.0,2016-12-01,2012-08-01,1583.0,1.0,02115
NCT01603277,19.34021263,Effect of KB003 in Subjects With Asthma Inadequately Controlled by Corticosteroids,Completed,Phase 2,Randomized,July 2012,January 2014,Treatment,Birmingham,Alabama,35216,All,16.0,2014-01-01,2012-07-01,549.0,1.0,35216
NCT01606319,19.0,Acetaminophen Versus Ibuprofen in Children With Asthma,Completed,Phase 3,Randomized,February 2013,April 2015,Treatment,Tucson,Arizona,85724,All,1.0,2015-04-01,2013-02-01,789.0,1.0,85724
NCT01612000,8.803742427,Safety and Immunogenicity of PanBlok Influenza Vaccine in Healthy Adults,Completed,Phase 1/Phase 2,Randomized,May 2012,December 2013,Prevention,Omaha,Nebraska,68134,All,18.0,2013-12-01,2012-05-01,579.0,1.0,68134
NCT01614457,2.941176471,Study of Ivacaftor in Subjects With Cystic Fibrosis (CF) Who Have the R117H-CF Transmembrane Conductance Regulator (CFTR) Mutation (KONDUCT),Completed,Phase 3,Randomized,July 2012,October 2013,Treatment,Birmingham,Alabama,,All,6.0,2013-10-01,2012-07-01,457.0,1.0,35203
NCT01623310,32.28699552,12-Month OL Intranasal Fluticasone Propionate BID Using OptiNose Device,Completed,Phase 3,,September 2013,October 2015,Treatment,Birmingham,Alabama,35216,All,18.0,2015-10-01,2013-09-01,760.0,1.0,35216
NCT01627327,6.730907967,Study to Evaluate the 24-Hour Pulmonary Function Profile of Fluticasone Furoate/Vilanterol (FF/VI) Inhalation Powder 100/25mcg Once Daily Compared With Tiotropium Bromide Inhalation Powder 18mcg Once Daily in Subjects With COPD Who Have or Are At Risk for Co-morbid Cardiovascular Disease,Completed,Phase 3,Randomized,"April 1, 2012","December 21, 2012",Treatment,Newport Beach,California,92663,All,40.0,2012-12-01,2012-04-01,244.0,1.0,92663
NCT01629589,3.545560225,Immunogenicity of Adacel® and BOOSTRIX® Vaccines in Adolescents,Completed,Phase 4,Randomized,June 2012,June 2013,Prevention,Sacramento,California,95816,All,11.0,2013-06-01,2012-06-01,365.0,1.0,95816
NCT01634113,1.075268817,Evaluation of Tiotropium 2.5 and 5 mcg Once Daily Delivered Via the Respimat® Inhaler Compared to Placebo in 1 to 5 Year Old Patients With Persistent Asthma,Completed,Phase 2,Randomized,July 2012,December 2014,Treatment,Columbia,Missouri,,All,18.0,2014-12-01,2012-07-01,883.0,1.0,06237
NCT01634139,5.260578645,Efficacy and Safety of 2 Doses of Tiotropium Respimat® Compared to Placebo in Children With Moderate Persistent Asthma,Completed,Phase 3,Randomized,July 2012,December 2015,Treatment,Columbia,Missouri,,All,6.0,2015-12-01,2012-07-01,1248.0,1.0,06237
NCT01634152,2.26576394,Efficacy and Safety of 2 Doses of Tiotropium Respimat® Compared to Placebo in Children With Severe Persistent Asthma,Completed,Phase 3,Randomized,July 2012,May 2015,Treatment,Rolling Hills Estates,California,,All,6.0,2015-05-01,2012-07-01,1034.0,1.0,03243
NCT01638546,4.294871795,Temozolomide With or Without Veliparib in Treating Patients With Relapsed or Refractory Small Cell Lung Cancer,Completed,Phase 2,Randomized,June 2012,January 2017,Treatment,Tampa,Florida,33612,All,18.0,2017-01-01,2012-06-01,1675.0,1.0,33612
NCT01641692,0.9642857143,A 3-period Crossover Study With GSK573719 as Monotherapy in Adult Subjects With Asthma,Completed,Phase 2,Randomized,May 2012,February 2013,Treatment,Newport Beach,California,92663,All,18.0,2013-02-01,2012-05-01,276.0,1.0,92663
NCT01641822,14.32459179,Phase 3 Study of Aztreonam for Inhalation Solution (AZLI) in a Continuous Alternating Therapy Regimen for the Treatment of Chronic Pseudomonas Aeruginosa Infection in Patients With CF,Completed,Phase 3,Randomized,December 2012,January 2015,Treatment,Birmingham,Alabama,35233,All,6.0,2015-01-01,2012-12-01,761.0,1.0,35233
NCT01645735,6.25,Evaluation of Ceftaroline Fosamil Versus a Comparator in Adult Subjects With Community-acquired Bacterial Pneumonia (CABP) With Risk for Methicillin-resistant Staphylococcus Aureus,Completed,Phase 4,Randomized,October 2012,December 2013,Treatment,Phoenix,Arizona,85008,All,18.0,2013-12-01,2012-10-01,426.0,1.0,85008
NCT01654224,6.787434075,Randomized Trial of High Dose Influenza Vaccine in Long Term Care Setting,Completed,Phase 4,Randomized,November 2011,June 2014,Prevention,Pittsburgh,Pennsylvania,15213,All,65.0,2014-06-01,2011-11-01,943.0,1.0,15213
NCT01654289,14.54212067,University of Wisconsin Meditation & Exercise Cold Study,Completed,Phase 2,Randomized,July 2012,June 2016,Prevention,Madison,Wisconsin,53715,All,30.0,2016-06-01,2012-07-01,1431.0,1.0,53715
NCT01654536,8.412866737,A 6 Month Safety Study Of Ciclesonide Nasal Aerosol (Zetonna®) And Ciclesonide Nasal Spray (Omnaris®) In Subjects 12 Years And Older With Perennial Allergic Rhinitis (PAR),Completed,Phase 4,Randomized,September 2012,July 2013,Treatment,Mission Viejo,California,92691,All,12.0,2013-07-01,2012-09-01,303.0,1.1,92691
NCT01659996,2.000965968,Study of Menactra® in Healthy Subjects at 9 Months and Concomitantly With Pentacel® at 15 to 18 Months of Age,Completed,Phase 4,Randomized,July 2012,September 2015,Prevention,Birmingham,Alabama,35235,All,0.75,2015-09-01,2012-07-01,1157.0,1.0,35235
NCT01662986,39.74358974,Investigate the Impact of Early Treatment Initiation With Tiotropium in Patients Recovering From Hospitalization for an Acute COPD Exacerbation 2,Completed,Phase 4,Randomized,"August 1, 2012","April 1, 2014",Treatment,Montgomery,Alabama,,All,40.0,2014-04-01,2012-08-01,608.0,1.0,12549
NCT01663987,24.16666667,Investigate the Impact of Early Treatment Initiation With Tiotropium in Patients Recovering From Hospitalization for an Acute COPD Exacerbation 1,Completed,Phase 4,Randomized,"August 1, 2012","May 1, 2014",Treatment,Birmingham,Alabama,,All,40.0,2014-05-01,2012-08-01,638.0,1.0,35203
NCT01666782,1.0,Study Comparing High-Dose Flu Vaccine to Standard Vaccine in Cancer Patients Less Than 65 Receiving Chemotherapy,Completed,Phase 2,Randomized,August 2012,December 2015,Prevention,Rochester,New York,14621,All,18.0,2015-12-01,2012-08-01,1217.0,1.0,14621
NCT01669174,17.9144385,BYM338 in Chronic Obstructive Pulmonary Disease (COPD) Patients With Cachexia,Completed,Phase 2,Randomized,September 2012,December 2014,Supportive Care,Torrance,California,90502,All,40.0,2014-12-01,2012-09-01,821.0,1.0,90502
NCT01682863,9.271099744,A Multi-centre Randomized Double Blind 52-week Study to Assess the Safety of QVA149 Compared to QAB149 in Patients With COPD Who Have Moderate to Severe Airflow Limitation,Completed,Phase 3,Randomized,October 2012,June 2014,Treatment,Vestavia,Alabama,35216,All,40.0,2014-06-01,2012-10-01,608.0,1.0,35216
NCT01685060,23.57142857,LDK378 in Adult Patients With ALK-activated NSCLC Previously Treated With Chemotherapy and Crizotinib,Completed,Phase 2,,"November 26, 2012","March 29, 2016",Treatment,Fayetteville,Arkansas,72703,All,18.0,2016-03-01,2012-11-01,1216.0,1.0,72703
NCT01686633,3.656999439,"An Efficacy and Safety Study of Fluticasone Furoate/Vilanterol (FF/VI) 200/25 Microgram (mcg) , FF/VI 100/25 mcg, and FF 100 mcg in Adults and Adolescents With Persistent Asthma.",Completed,Phase 3,Randomized,"September 20, 2012","October 15, 2013",Treatment,Little Rock,Arkansas,72205,All,12.0,2013-10-01,2012-09-01,395.0,1.0,72205
NCT01688921,1.924877557,Jet Injection for Influenza,Completed,Phase 4,Randomized,October 2012,March 2013,Prevention,Fort Collins,Colorado,80524,All,18.0,2013-03-01,2012-10-01,151.0,1.0,80524
NCT01691508,5.204216074,Mepolizumab Steroid-Sparing Study in Subjects With Severe Refractory Asthma,Completed,Phase 3,Randomized,October 2012,December 2013,Treatment,Long Beach,California,90808,All,12.0,2013-12-01,2012-10-01,426.0,1.0,90808
NCT01691521,5.216710746,Efficacy and Safety Study of Mepolizumab Adjunctive Therapy in Subjects With Severe Uncontrolled Refractory Asthma,Completed,Phase 3,Randomized,"October 8, 2012","January 18, 2014",Treatment,Birmingham,Alabama,35294,All,12.0,2014-01-01,2012-10-01,457.0,1.0,35294
NCT01694771,6.978976448,Co-administration of Olodaterol Respimat® and Tiotropium Handihaler®,Completed,Phase 3,Randomized,September 2012,August 2013,Treatment,Florence,Alabama,,All,40.0,2013-08-01,2012-09-01,334.0,1.0,01062
NCT01696058,6.082365069,Co-administration of Olodaterol Respimat® and Tiotropium Handihaler®,Completed,Phase 3,Randomized,September 2012,October 2013,Treatment,Anniston,Alabama,,All,40.0,2013-10-01,2012-09-01,395.0,1.0,36201
NCT01697696,16.37045568,Long Term Safety Study of NVA237 vs QAB149 in COPD Patients,Completed,Phase 3,Randomized,October 2012,November 2014,Treatment,Gulf Shores,Alabama,36547,All,40.0,2014-11-01,2012-10-01,761.0,7.0,36547
NCT01697956,2.370478983,Hypothalamic-Pituitary-Adrenal (HPA)-Axis Study in Pediatric Subjects With Perennial Allergic Rhinitis (PAR),Completed,Phase 3,Randomized,October 2012,February 2013,Treatment,Long Beach,California,,All,6.0,2013-02-01,2012-10-01,123.0,1.0,11561
NCT01706328,7.125186706,A Study to Assess the Efficacy of Fluticasone Furoate/Vilanterol (FF/VI) Inhalation Powder 100/25 mcg Once Daily Compared With Fluticasone Propionate/Salmeterol Inhalation Powder 250/50 mcg Twice Daily in Subjects With Chronic Obstructive Pulmonary Disease (COPD),Completed,Phase 3,Randomized,"October 15, 2012","June 17, 2013",Treatment,Clearwater,Florida,33765,All,40.0,2013-06-01,2012-10-01,243.0,1.0,33765
NCT01706536,6.089626566,A Study of the Efficacy and Safety of EP-101 ( (SUN101) in Subjects With Moderate to Severe Chronic Obstructive Pulmonary Disease,Completed,Phase 2,Randomized,October 2012,April 2013,Treatment,Jasper,Alabama,35501,All,35.0,2013-04-01,2012-10-01,182.0,4.2,35501
NCT01707290,20.66115702,Rollover Study of Ivacaftor in Subjects With Cystic Fibrosis and a Non G551D CFTR Mutation,Completed,Phase 3,Non-Randomized,February 2013,April 2016,Treatment,Birmingham,Alabama,,All,6.0,2016-04-01,2013-02-01,1155.0,1.0,35203
NCT01709864,3.631371097,NVA237 Versus Placebo 12-week Efficacy Study,Completed,Phase 3,Randomized,November 2012,October 2013,Treatment,Homewood,Alabama,35209-6870,All,40.0,2013-10-01,2012-11-01,334.0,1.0,35209
NCT01711645,25.45454545,Tdap Vaccine in Post-Partum Women,Completed,Phase 4,,"October 26, 2012","August 28, 2015",Prevention,Nashville,Tennessee,37232-2573,Female,18.0,2015-08-01,2012-10-01,1034.0,1.0,37232
NCT01712334,1.176470588,A Study of the Comparable Efficacy and Safety of Pulmozyme (Dornase Alfa) Delivered by the eRapid Nebulizer System in Patients With Cystic Fibrosis,Completed,Phase 4,Randomized,December 2012,June 2013,Treatment,Phoenix,Arizona,85016,All,6.0,2013-06-01,2012-12-01,182.0,1.0,85016
NCT01712516,2.899241588,"A 12-week Treatment, Multi-center, Randomized, Double-blind, Parallel-group, Placebo and Active Controlled Study to Assess the Efficacy, Safety, and Tolerability of Indacaterol Maleate / Glycopyrronium Bromide in COPD Patients With Moderate to Severe Airflow Limitation",Completed,Phase 3,Randomized,December 2012,February 2014,Treatment,Huntsville,Alabama,35801,All,40.0,2014-02-01,2012-12-01,427.0,1.0,35801
NCT01712984,1.350186635,Study of Intradermal Quadrivalent Influenza Vaccine in Adults Aged 18 Through 64 Years,Completed,Phase 3,Randomized,October 2012,October 2013,Prevention,Hoover,Alabama,35216,All,18.0,2013-10-01,2012-10-01,365.0,1.0,35216
NCT01715298,4.166666667,NVA237 BID Versus Placebo Twelve-week Efficacy Study,Completed,Phase 3,Randomized,November 2012,December 2013,Treatment,*See Various Dept.'s*,Arizona,85224,All,40.0,2013-12-01,2012-11-01,395.0,1.0,85224
NCT01716754,5.091237497,Efficacy and Safety of QGE031versus Placebo and Omalizumab in Patients Aged 18-75 Years With Asthma,Completed,Phase 2,Randomized,December 2012,January 2016,Treatment,Fresno,California,93720,All,18.0,2016-01-01,2012-12-01,1126.0,1.0,93720
NCT01727141,2.20674919,"A 12 Week Treatment, Multi-center, Randomized, Double-blind, Parallel-group, Placebo and Active Controlled Study to Assess the Efficacy, Safety, and Tolerability of Indacaterol Maleate / Glycopyrronium Bromide in COPD Patients With Moderate to Severe Airflow Limitation.",Completed,Phase 3,Randomized,November 2012,February 2014,Treatment,Birmingham,Alabama,35205,All,40.0,2014-02-01,2012-11-01,457.0,1.0,35205
NCT01729559,13.52693603,Venous Thromboembolic Prophylaxis After Trauma: Three Times a Day Unfractionated Heparin Versus Twice a Day Enoxaparin,Completed,Phase 4,Randomized,November 2012,October 2014,Prevention,San Diego,California,92103,All,18.0,2014-10-01,2012-11-01,699.0,1.0,92103
NCT01732536,2.007226014,Steroid-Releasing S8 Sinus Implant for Recurrent Nasal Polyps,Completed,Phase 2/Phase 3,Randomized,January 2013,May 2014,Treatment,Atherton,California,94027,All,18.0,2014-05-01,2013-01-01,485.0,1.0,94027
NCT01743001,0.4385964912,Clinical Study to Evaluate the Effects of Macitentan on Exercise Capacity in Subjects With Eisenmenger Syndrome,Completed,Phase 3,Randomized,"May 21, 2013","December 1, 2016",Treatment,Los Angeles,California,90095,All,12.0,2016-12-01,2013-05-01,1310.0,1.0,90095
NCT01745848,23.07692308,Roflumilast on Markers of Bone Metabolism and Endothelial Function in COPD,Completed,Phase 4,,February 2013,"June 30, 2016",Treatment,Pittsburgh,Pennsylvania,15213,All,50.0,2016-06-01,2013-02-01,1216.0,1.0,15213
NCT01747629,8.117647059,Efficacy of Inhaled Albuterol Spiromax® in Subjects With Persistent Asthma With Steady State Pharmacokinetics,Completed,Phase 3,Randomized,December 2012,November 2013,Treatment,Costa Mesa,California,,All,12.0,2013-11-01,2012-12-01,335.0,1.0,92626
NCT01755091,19.45955279,Safety and Efficacy Study of Dronabinol to Treat Obstructive Sleep Apnea,Completed,Phase 2,Randomized,February 2013,"December 31, 2016",Treatment,Chicago,Illinois,60611,All,21.0,2016-12-01,2013-02-01,1399.0,1.0,60611
NCT01764841,17.24464264,Ciprofloxacin Dry Powder for Inhalation in Non-cystic Fibrosis Bronchiectasis (Non-CF BE),Completed,Phase 3,Randomized,"May 2, 2013","March 9, 2016",Treatment,Jasper,Alabama,35501,All,18.0,2016-03-01,2013-05-01,1035.0,4.2,35501
NCT01766921,2.797258297,Safety and Immunogenicity of Two Doses of H5N1 Influenza Vaccine in Elderly Subjects,Completed,Phase 2,Randomized,January 2013,July 2014,Prevention,Phoenix,Arizona,85253,All,65.0,2014-07-01,2013-01-01,546.0,1.0,85253
NCT01769391,7.081339713,A Study of Necitumumab and Chemotherapy in Participants With Stage IV Squamous Non-Small Cell Lung Cancer,Completed,Phase 2,Randomized,January 2013,July 2017,Treatment,Jonesboro,Arkansas,72401,All,18.0,2017-07-01,2013-01-01,1642.0,1.0,72401
